<?xml version="1.0" encoding="UTF-8"?>

<!DOCTYPE pokemons SYSTEM "valiDTD.dtd">

<pokemons>
    <pokemon tipo="Hielo">
        <nombre maxlength="10">Charizard </nombre>
        <codigo pattern="PK-">0001</codigo>
        <foto>/img/pokemon1</foto>
        <color>Azul</color>  
        <fuerza>23</fuerza>
        <comentario maxlength="50">Lorem ipsum</comentario>
    </pokemon>
    <pokemon tipo="Fuego">
        <nombre maxlength="10">Pikachu </nombre>
        <codigo pattern="PK-">0001</codigo>
        <foto>/img/pokemon2</foto>
        <color>Azul</color>  
        <fuerza>55</fuerza>
        <comentario maxlength="50">Lorem ipsum</comentario>
    </pokemon>
    <pokemon tipo="Agua">
        <nombre maxlength="10">Bulbasur </nombre>
        <codigo pattern="PK-">0001</codigo>
        <foto>/img/pokemon3</foto>
        <color>Rojo</color>  
        <fuerza>88</fuerza>
        <comentario maxlength="50">Lorem ipsum</comentario>
    </pokemon>

</pokemons>